{
  "schema_version": 1,
  "build": {
    "product": "synthetic-d2r-fixture",
    "build_key": "fixture-only",
    "version": "fixture-1",
    "input_sha256": []
  },
  "canonical_items": [
    {"id":"unique:alpha","source_table":"uniqueitems.txt","source_key":"alpha","names":[{"locale":"enUS","string_key":"fixture_alpha","text":"Alpha"},{"locale":"zhCN","string_key":"fixture_alpha_cn","text":"阿尔法"}]},
    {"id":"unique:alpha-crown","source_table":"uniqueitems.txt","source_key":"alpha-crown","names":[{"locale":"enUS","string_key":"fixture_alpha_crown","text":"Alpha Crown"},{"locale":"zhTW","string_key":"fixture_alpha_crown_tw","text":"阿爾法王冠"}]},
    {"id":"unique:red-moon","source_table":"uniqueitems.txt","source_key":"red-moon","names":[{"locale":"enUS","string_key":"fixture_red_moon","text":"Red Moon"},{"locale":"zhCN","string_key":"fixture_red_moon_duplicate","text":"Red Moon"}]},
    {"id":"unique:blue-sun","source_table":"uniqueitems.txt","source_key":"blue-sun","names":[{"locale":"enUS","string_key":"fixture_blue_sun","text":"Blue Sun"}]},
    {"id":"unique:glyph17","source_table":"uniqueitems.txt","source_key":"glyph17","names":[{"locale":"enUS","string_key":"fixture_glyph17","text":"Glyph 17"}]},
    {"id":"set-item:jade-band","source_table":"setitems.txt","source_key":"jade-band","names":[{"locale":"enUS","string_key":"fixture_jade_band","text":"Jade-Band"},{"locale":"zhCN","string_key":"fixture_jade_band_cn","text":"翠玉环"}]},
    {"id":"set-item:alpha","source_table":"setitems.txt","source_key":"set-alpha","names":[{"locale":"enUS","string_key":"fixture_set_alpha","text":"Alpha"}]},
    {"id":"base:r01","source_table":"misc.txt","source_key":"r01","names":[{"locale":"enUS","string_key":"fixture_r01","text":"Fixture Rune One"}]},
    {"id":"base:r17","source_table":"misc.txt","source_key":"r17","names":[{"locale":"zhTW","string_key":"fixture_r17","text":"測試符文十七"}]},
    {"id":"base:r33","source_table":"misc.txt","source_key":"r33","names":[{"locale":"zhCN","string_key":"fixture_r33","text":"测试符文三十三"}]}
  ],
  "affixes": [],
  "aliases": [],
  "findings": []
}
